{
  "schema_version": 1,
  "diagram_type": "dataflow",
  "meta": {
    "title": "Parallel governed data pipelines",
    "output": "content-pipelines.html",
    "canvas_fit": "content",
    "quality_profile": "standard"
  },
  "stages": [
    {
      "label": "Collect"
    },
    {
      "label": "Parse"
    },
    {
      "label": "Validate"
    },
    {
      "label": "Enrich"
    },
    {
      "label": "Store"
    }
  ],
  "nodes": [
    {
      "id": "step-0",
      "type": "backend",
      "label": "Collect 1",
      "stage": 0,
      "row": 0,
      "yOffset": 0
    },
    {
      "id": "step-1",
      "type": "backend",
      "label": "Parse 1",
      "stage": 1,
      "row": 0,
      "yOffset": 0
    },
    {
      "id": "step-2",
      "type": "backend",
      "label": "Validate 1",
      "stage": 2,
      "row": 0,
      "yOffset": 0
    },
    {
      "id": "step-3",
      "type": "backend",
      "label": "Enrich 1",
      "stage": 3,
      "row": 0,
      "yOffset": 0
    },
    {
      "id": "step-4",
      "type": "database",
      "label": "Store 1",
      "stage": 4,
      "row": 0,
      "yOffset": 0
    },
    {
      "id": "step-5",
      "type": "backend",
      "label": "Collect 2",
      "stage": 0,
      "row": 1,
      "yOffset": 120
    },
    {
      "id": "step-6",
      "type": "backend",
      "label": "Parse 2",
      "stage": 1,
      "row": 1,
      "yOffset": 120
    },
    {
      "id": "step-7",
      "type": "backend",
      "label": "Validate 2",
      "stage": 2,
      "row": 1,
      "yOffset": 120
    },
    {
      "id": "step-8",
      "type": "backend",
      "label": "Enrich 2",
      "stage": 3,
      "row": 1,
      "yOffset": 120
    },
    {
      "id": "step-9",
      "type": "database",
      "label": "Store 2",
      "stage": 4,
      "row": 1,
      "yOffset": 120
    },
    {
      "id": "step-10",
      "type": "backend",
      "label": "Collect 3",
      "stage": 0,
      "row": 2,
      "yOffset": 240
    },
    {
      "id": "step-11",
      "type": "backend",
      "label": "Parse 3",
      "stage": 1,
      "row": 2,
      "yOffset": 240
    },
    {
      "id": "step-12",
      "type": "backend",
      "label": "Validate 3",
      "stage": 2,
      "row": 2,
      "yOffset": 240
    },
    {
      "id": "step-13",
      "type": "backend",
      "label": "Enrich 3",
      "stage": 3,
      "row": 2,
      "yOffset": 240
    },
    {
      "id": "step-14",
      "type": "database",
      "label": "Store 3",
      "stage": 4,
      "row": 2,
      "yOffset": 240
    },
    {
      "id": "step-15",
      "type": "backend",
      "label": "Collect 4",
      "stage": 0,
      "row": 3,
      "yOffset": 360
    },
    {
      "id": "step-16",
      "type": "backend",
      "label": "Parse 4",
      "stage": 1,
      "row": 3,
      "yOffset": 360
    },
    {
      "id": "step-17",
      "type": "backend",
      "label": "Validate 4",
      "stage": 2,
      "row": 3,
      "yOffset": 360
    },
    {
      "id": "step-18",
      "type": "backend",
      "label": "Enrich 4",
      "stage": 3,
      "row": 3,
      "yOffset": 360
    },
    {
      "id": "step-19",
      "type": "database",
      "label": "Store 4",
      "stage": 4,
      "row": 3,
      "yOffset": 360
    },
    {
      "id": "step-20",
      "type": "backend",
      "label": "Collect 5",
      "stage": 0,
      "row": 4,
      "yOffset": 480
    },
    {
      "id": "step-21",
      "type": "backend",
      "label": "Parse 5",
      "stage": 1,
      "row": 4,
      "yOffset": 480
    },
    {
      "id": "step-22",
      "type": "backend",
      "label": "Validate 5",
      "stage": 2,
      "row": 4,
      "yOffset": 480
    },
    {
      "id": "step-23",
      "type": "backend",
      "label": "Enrich 5",
      "stage": 3,
      "row": 4,
      "yOffset": 480
    },
    {
      "id": "step-24",
      "type": "database",
      "label": "Store 5",
      "stage": 4,
      "row": 4,
      "yOffset": 480
    }
  ],
  "flows": [
    {
      "id": "transfer-0",
      "from": "step-0",
      "to": "step-1",
      "label": "record"
    },
    {
      "id": "transfer-1",
      "from": "step-1",
      "to": "step-2",
      "label": "record"
    },
    {
      "id": "transfer-2",
      "from": "step-2",
      "to": "step-3",
      "label": "record"
    },
    {
      "id": "transfer-3",
      "from": "step-3",
      "to": "step-4",
      "label": "record"
    },
    {
      "id": "transfer-5",
      "from": "step-5",
      "to": "step-6",
      "label": "record"
    },
    {
      "id": "transfer-6",
      "from": "step-6",
      "to": "step-7",
      "label": "record"
    },
    {
      "id": "transfer-7",
      "from": "step-7",
      "to": "step-8",
      "label": "record"
    },
    {
      "id": "transfer-8",
      "from": "step-8",
      "to": "step-9",
      "label": "record"
    },
    {
      "id": "transfer-10",
      "from": "step-10",
      "to": "step-11",
      "label": "record"
    },
    {
      "id": "transfer-11",
      "from": "step-11",
      "to": "step-12",
      "label": "record"
    },
    {
      "id": "transfer-12",
      "from": "step-12",
      "to": "step-13",
      "label": "record"
    },
    {
      "id": "transfer-13",
      "from": "step-13",
      "to": "step-14",
      "label": "record"
    },
    {
      "id": "transfer-15",
      "from": "step-15",
      "to": "step-16",
      "label": "record"
    },
    {
      "id": "transfer-16",
      "from": "step-16",
      "to": "step-17",
      "label": "record"
    },
    {
      "id": "transfer-17",
      "from": "step-17",
      "to": "step-18",
      "label": "record"
    },
    {
      "id": "transfer-18",
      "from": "step-18",
      "to": "step-19",
      "label": "record"
    },
    {
      "id": "transfer-20",
      "from": "step-20",
      "to": "step-21",
      "label": "record"
    },
    {
      "id": "transfer-21",
      "from": "step-21",
      "to": "step-22",
      "label": "record"
    },
    {
      "id": "transfer-22",
      "from": "step-22",
      "to": "step-23",
      "label": "record"
    },
    {
      "id": "transfer-23",
      "from": "step-23",
      "to": "step-24",
      "label": "record"
    }
  ]
}
